{
  "kind": "clip",
  "id": "ryo-walk-guard-fwd",
  "status": "final",
  "source": "meshy-library",
  "clip": "Walk_Fight_Forward_inplace",
  "frames_total": 104,
  "hit_start": null,
  "hit_end": null,
  "retarget_notes": "Ryo rig 01a10e47-857e-73a0-9f7a-cd74795198fb (GO, YOK-31). Guard hands held, no clipping (0 arm verts in torso core), max joint rate 5.4 deg per tick.",
  "rules": [
    "F2",
    "F5",
    "F6"
  ],
  "notes": "Meshy preset 689 Walk_Fight_Forward_inplace on task 01a1100b-c587-72dd-b1c0-afee2b13bbbf, file ryo-walk-guard-fwd.glb. Raw trim: ticks 0-104 at 1x (60 ticks per second). Verdict PASS. Raw 105 ticks (1.73 s), in place (drift 2 mm), loop 104 frames; loop closes within 2.1 deg. Stance-foot ground speed only about 0.6 m/s (0.010 m per tick), much slower than the neutral walk (1.39): set data speed to about 0.010 m/tick or play at up to 1.5x to avoid sliding."
}
