{
  "kind": "clip",
  "id": "ryo-jump-kick",
  "status": "proposed",
  "source": "meshy-library",
  "clip": "Rising_Flying_Kick",
  "frames_total": 25,
  "trim_start": 22,
  "trim_end": 46,
  "speed_scale": 1,
  "file": "assets/generated/clips/ryo/ryo-jump-kick.glb",
  "hit_start": 7,
  "hit_end": 16,
  "retarget_notes": "Ryo rig 01a10e47-857e-73a0-9f7a-cd74795198fb (GO, YOK-31). WARN: the body tips to horizontal at the apex (a flying side kick, not a jump-in knee). Arm verts in torso core 31. Leg-vs-leg axis min 2.6 cm at takeoff. Stretched edges 5.8x.",
  "rules": [
    "F2",
    "F5",
    "F6"
  ],
  "notes": "Meshy preset 422 Rising_Flying_Kick on task 01a1100b-c3f6-7505-b271-e44951bd8675, file ryo-jump-kick.glb. Raw trim: ticks 4-66 at 1x (60 ticks per second). Verdict WARN. Raw 93 ticks (1.53 s). Airborne raw 6-41 (peak foot 1.0 m); leg is horizontal and fully extended raw 28-37 (foot reach 0.85 m at 31). Trim raw 4-66: 63 frames, hit frames 25-34. Root travels 1.39 m forward in the window (strip, drift is data). Jump-in kick slot (E11). RE-TIMED (YOK-32 free pass, data only: trim and speed, no hand keying; supersedes the trim above; was 63 frames, hit 25-34): trim raw ticks 22-46 at 1.0x = 25 frames, hit frames 7-16, startup 6, active 10, recovery 9. starts mid-air at raw 22 (airborne raw 6-41), ends at raw 46 before the landing; blend in from the jump over about 4 ticks (the kick pose is already half built at raw 22)."
}
