{
  "kind": "clip",
  "id": "ryo-foxfire-cast",
  "status": "proposed",
  "source": "meshy-library",
  "clip": "mage_soell_cast_7",
  "frames_total": 92,
  "hit_start": 16,
  "hit_end": 19,
  "retarget_notes": "Ryo rig 01a10e47-857e-73a0-9f7a-cd74795198fb (GO, YOK-31). Reads well (clean palm-forward cast), no clipping (0 arm verts in torso core). WARN only for the 55 cm root step: stripping it slides the left foot about 26 cm. Peak joint rate 13.7 deg per tick.",
  "rules": [
    "F2",
    "F5",
    "F6"
  ],
  "notes": "Meshy preset 136 mage_soell_cast_7 on task 01a1100b-c129-7727-8ad9-cdc35fb05ff9, file ryo-foxfire.glb. Raw trim: ticks 39-130 at 1x (60 ticks per second). Verdict WARN. S03 Foxfire (Tanuki copy uses Ryo's model, T0). Raw 163 ticks (2.7 s). One-arm forward cast with a held extension (raw 54-98, reach 0.52 m). The right foot steps forward 55 cm (raw 30-50) and back at raw 105-130, the hips travel 37 cm: carry the step in move data. Trim raw 39-130: 92 frames, hit frames 16-19 (startup 15, active 4); target total 49, so blend out at about raw 88."
}
