{
  "kind": "clip",
  "id": "ryo-walk-fwd",
  "status": "final",
  "source": "meshy-library",
  "clip": "walking_man",
  "frames_total": 64,
  "hit_start": null,
  "hit_end": null,
  "retarget_notes": "Ryo rig 01a10e47-857e-73a0-9f7a-cd74795198fb (GO, YOK-31). PASS in YOK-31: no coat, sleeve or leg clipping.",
  "rules": [
    "F2",
    "F5",
    "F6"
  ],
  "notes": "Meshy rig walk walking_man on task rig-walk, file ryo-walk.glb. Raw trim: ticks 0-64 at 1x (60 ticks per second). Verdict PASS. Free walk from the rig task (game/assets/generated/characters/ryo/ryo-walk.glb), no credits. Loop 64 frames (1.067 s). In place, loop closes with no pop; stance-foot ground speed 1.39 m/s (about 0.023 m per tick), so data speed should be 0.023 m/tick to avoid sliding. Neutral walk, not guarded."
}
