{
  "kind": "clip",
  "id": "ryo-heavy-kick",
  "status": "proposed",
  "source": "meshy-library",
  "rules": [
    "F2",
    "F5",
    "F6"
  ],
  "clip": "High_Kick",
  "frames_total": 38,
  "trim_start": 46,
  "trim_end": 93,
  "speed_scale": 1.25,
  "file": "assets/generated/clips/ryo/ryo-hk.glb",
  "hit_start": 12,
  "hit_end": 15,
  "retarget_notes": "Ryo rig 01a10e47-857e-73a0-9f7a-cd74795198fb (GO, YOK-31). WARN: head-high kick (not mid), 36-50 cm of hip travel and a 21 cm slide of the left foot if stripped. Max edge stretch 5.9x (crotch), no clipping in the stills, no spin or airborne phase.",
  "notes": "Meshy preset 215 High_Kick (take 2 of 3, designer-approved; replaces the 207 roundhouse) on task 01a1101d-8fc1-70e8-9782-2ba6cf7fbaa3, file game/assets/generated/clips/ryo/ryo-hk.glb. Raw 124 ticks (2.07 s): guard, right foot rises from raw 44, full extension raw 60-64 (peak 9.0 m/s at raw 63), foot at 129-144 cm so it is a HIGH kick, not a mid kick (the preset has no mid variant). No spin: torso lean 11 to 39 deg. Trim raw 46-93 at 1.25x = 38 frames: hit frames 12-15 (raw 61-65, foot at 94-97% of reach), startup 11, active 4, recovery 23 (target 12/4/22). Peak joint rate 20.9 deg per raw tick = 26 at 1.25x (limit 30). Hips travel 50 cm in the trim window (move data); stripped, the left planted foot slides 21 cm and the right 5 cm. Foot at 66% reach at the cut: blend out."
}
