{
  "kind": "clip",
  "id": "kitsune-idle",
  "status": "final",
  "source": "meshy-library",
  "clip": "250 Idle_10",
  "frames_total": 222,
  "hit_start": null,
  "hit_end": null,
  "retarget_notes": "PASS. Guard-stance loop, arms close to the body. Loop closes (max joint 0.3 deg first vs last), root drift 0, feet planted 0 cm. Hips sit 12 cm lower than a neutral stand (stance). Tail proxy clear; sleeves stable (no hit frames).",
  "rules": [
    "F2",
    "F6"
  ],
  "notes": "Kitsune rig 01a10e47-91f6-709b-bd34-8884f8cbabbb; task 01a1100b-8ac2-7638-8dca-a0a81de6ab39; file game/assets/generated/clips/kitsune/kitsune-idle.glb; trim raw 60 fps ticks 0-221 inclusive (trim is data, no hand keying). Loop, 222 ticks (3.7 s). Same preset id as Ryo idle if YOK-32 picks 250."
}