{
  "kind": "clip",
  "id": "kitsune-heavy-kick",
  "status": "proposed",
  "source": "meshy-library",
  "rules": [
    "F2",
    "F5",
    "F6"
  ],
  "clip": "High_Kick",
  "frames_total": 38,
  "hit_start": 12,
  "hit_end": 15,
  "retarget_notes": "Kitsune rig 01a10e47-91f6-709b-bd34-8884f8cbabbb. WARN: same head-high kick. The hakama is drawn into a tube around the kicking leg at raw 62-72 (stills) with sleeve/hakama stretch up to 13.6x (limit 14, accepted heavy punch 9.6x at its hit); no inversion or poke-through; tail proxy clear of the leg (-6 cm proxy clearance reads as the hakama, stills clean). Left foot slides 35 cm if the hip travel (about 45 cm) is stripped, so replay it from move data.",
  "notes": "Meshy preset 215 High_Kick (take 2 of 3, designer-approved; replaces the 207 roundhouse) on task 01a1101d-91e6-706a-aea6-a3195cdc82a3, file game/assets/generated/clips/kitsune/kitsune-hk.glb. Raw 124 ticks (2.07 s): guard, right foot rises from raw 44, full extension raw 60-64 (peak 9.0 m/s at raw 63), foot at 129-144 cm so it is a HIGH kick, not a mid kick (the preset has no mid variant). No spin: torso lean 11 to 39 deg. Trim raw 46-93 at 1.25x = 38 frames: hit frames 12-15 (raw 61-65, foot at 94-97% of reach), startup 11, active 4, recovery 23 (target 12/4/22). Peak joint rate 20.9 deg per raw tick = 26 at 1.25x (limit 30). Hips travel 45 cm in the trim window (move data); stripped, the left planted foot slides 35 cm and the right 5 cm. Foot at 66% reach at the cut: blend out."
}
